{
  "schema_version": "tl-syntax.formula/v1",
  "semantic_profile": "mltl.closed-trace/v1",
  "root": 2,
  "nodes": [
    { "kind": "proposition", "proposition": 0, "span": { "start": 0, "end": 7 } },
    { "kind": "future", "interval": { "start": 0, "end": 1 }, "operand": 0 },
    { "kind": "not", "operand": 1 }
  ]
}
